{"contract_version":"v1","request_id":"request_v1_01J8Q3Z4R5T6V7W8X9Y0ABCDEF","task_ref":"task_v1_01J8Q3Z4R5T6V7W8X9Y0ABCDEF","project_ref":"project_v1_01J8Q3Z4R5T6V7W8X9Y0ABCDEF","trace_id":"trace_v1_01J8Q3Z4R5T6V7W8X9Y0ABCDEF","intent_kind":"brain","intent_ref":"intent_v1_01J8Q3Z4R5T6V7W8X9Y0ABCDEF","requested_at":"2026-07-31T09:00:00Z","clarification":{"required":false,"questions":[]},"risk_class":"medium","hard_bounds":{"timeout_seconds":600,"max_steps":50,"max_retries":2,"max_cost_minor":750,"currency":"EUR"},"idempotency_key":"n8n-request-01J8Q3Z4R5T6V7W8X9Y0ABCDEF"}
